<?xml version="1.0" encoding="UTF-8"?>

<buzztard
  xmlns="http://www.buzztard.org/"
  xmlns:xsd="http://www.w3.org/2001/XMLSchema-instance"
  xsd:noNamespaceSchemaLocation="buzztard.xsd">

  <meta>
    <info>one buzz generator</info>
      <name>buzz 4</name>
    <genre>dark-wave</genre>
    <create-dts>2005-09-20T22:10:56Z</create-dts>
    <change-dts>2005-09-20T22:10:56Z</change-dts>
    <bpm>120</bpm>
    <tpb>4</tpb>
    <bars>16</bars>
  </meta>
  
  <setup>
    <machines>
      <machine type="sink" id="audio_sink">
        <properties>
          <property key="xpos" value="0.7"/>
          <property key="ypos" value="0.5"/>
        </properties>
      </machine>
      
      <machine type="source" id="gen" plugin-name="bml-Arguelles-GoaKick" voices="0">
        <properties>
          <property key="xpos" value="-0.7"/>
          <property key="ypos" value="-0.5"/>
        </properties>
        <patterns>
          <pattern id="gen_beats" name="beats" length="16">
            <tick time="0">
              <globaldata name="Trigger" value="10"/>
              <globaldata name="Tone" value="40"/>
            </tick>
            <tick time="4"><globaldata name="Trigger" value="40"/></tick>
            <tick time="8"><globaldata name="Trigger" value="80"/></tick>
          </pattern>
        </patterns>
      </machine>
    </machines>
    
    <wires>
      <wire src="gen" dst="audio_sink" gain="1.0" panorama="-50"/>
    </wires>    
  </setup>
    
  <sequence length="96" tracks="1">
    <labels>
      <label time="0" name="start"/>
      <label time="95" name="end"/>
    </labels>
    <tracks>
      <track index="0" machine="gen">
        <position time="0" pattern="gen_beats"/>
        <position time="32" pattern="gen_beats"/>
        <position time="48" pattern="gen_beats"/>
        <position time="64" pattern="gen_beats"/>
        <position time="80" pattern="gen_beats"/>
      </track>
    </tracks>
  </sequence>
  
</buzztard>
