<?xml version="1.0" encoding="UTF-8"?>

<buzztard
  xmlns="http://www.buzztard.org/"
  xmlns:xsd="http://www.w3.org/2001/XMLSchema-instance"
  xsd:noNamespaceSchemaLocation="buzztard.xsd">

  <meta>
    <info>a two voice melody</info>
    <name>melo 2</name>
    <genre>chip-music</genre>
    <bpm>120</bpm>
    <tpb>4</tpb>
    <bars>16</bars>
    <create-dts>2006-01-12T22:10:56Z</create-dts>
    <change-dts>2006-01-12T22:10:56Z</change-dts>
  </meta>
  
  <setup>
    <machines>
      <machine type="sink" id="audio_sink">
        <properties>
          <property key="xpos" value="0.7"/>
          <property key="ypos" value="0.0"/>
        </properties>
        <globaldata name="volume" value="20"/>
        <globaldata name="bpm" value="145"/>
      </machine>
            
      <machine type="source" id="beep1" plugin-name="simsyn" voices="0">
        <properties>
          <property key="xpos" value="-0.7"/>
          <property key="ypos" value="-0.5"/>
        </properties>
        <globaldata name="volume" value="1.0"/>
        <patterns>
          <pattern id="beep1::C-3_E-3_G-3" machine="beep1" name="C-3_E-3_G-3" length="16">
            <tick time="0">
              <globaldata name="note" value="c-3"/>
              <globaldata name="volume" value="1.0"/>
              <globaldata name="decay" value="0.25"/>
              <globaldata name="wave" value="2"/>
            </tick>
            <tick time="8">
              <globaldata name="note" value="e-3"/>
            </tick>
            <tick time="12">
              <globaldata name="note" value="g-3"/>
            </tick>
          </pattern>
        </patterns>
      </machine>
    </machines>
    
    <wires>
      <wire src="beep1" dst="audio_sink" gain="1.0"/>
    </wires>    
  </setup>
    
  <sequence loop="off" length="64" tracks="2">
    <labels>
      <label time="0" name="start"/>
      <label time="63" name="end"/>
    </labels>
    <tracks>
      <track index="0" machine="beep1">
        <position time="0" pattern="beep1::C-3_E-3_G-3"/>
        <position time="32" pattern="beep1::C-3_E-3_G-3"/>
      </track>
      <track index="1" machine="audio_sink"/>
    </tracks>
  </sequence>

</buzztard>
