<?xml version="1.0"?>
<buzztard xmlns="http://www.buzztard.org/" xmlns:xsd="http://www.w3.org/2001/XMLSchema-instance" xsd:noNamespaceSchemaLocation="buzztard.xsd">
  <meta>
    <info>what a lovely tune</info>
    <name>test simple 5</name>
    <genre>dark-wave</genre>
    <author>Stefan Kost</author>
    <create-dts>2005-09-20T22:10:56Z</create-dts>
    <change-dts>2008-04-06T12:58:20Z</change-dts>
    <bpm>100</bpm>
    <tpb>8</tpb>
    <bars>16</bars>
  </meta>
  <setup>
    <properties>
      <property key="ypos" value="168.51658593378852"/>
      <property key="active-page" value="0"/>
    </properties>
    <machines>
      <machine id="audio_sink" type="sink">
        <properties>
          <property key="ypos" value="0.5"/>
          <property key="xpos" value="0.7"/>
        </properties>
        <globaldata name="master-volume" value="1"/>
        <patterns>
          <pattern id="audio_sink 00" name="00" length="16">
            <tick time="0">
              <globaldata name="master-volume" value="0.62500953688868544"/>
            </tick>
            <tick time="15">
              <globaldata name="master-volume" value="10.000152590218967"/>
            </tick>
          </pattern>
        </patterns>
      </machine>
      <machine id="amp1" type="processor" plugin-name="volume" voices="0">
        <properties>
          <property key="ypos" value="0.0"/>
          <property key="xpos" value="0.3"/>
        </properties>
        <globaldata name="mute" value="0"/>
        <globaldata name="volume" value="1"/>
      </machine>
      <machine id="sine1" type="source" plugin-name="audiotestsrc" voices="0">
        <properties>
          <property key="ypos" value="0.5"/>
          <property key="xpos" value="0.0"/>
        </properties>
        <globaldata name="wave" value="0"/>
        <globaldata name="freq" value="440"/>
        <globaldata name="volume" value="0.10000000000000001"/>
        <patterns>
          <pattern id="sine1_beep" name="beeps" length="3">
            <tick time="0">
              <globaldata name="freq" value="440"/>
            </tick>
            <tick time="1">
              <globaldata name="freq" value="880"/>
            </tick>
            <tick time="2">
              <globaldata name="freq" value="1760"/>
            </tick>
          </pattern>
        </patterns>
      </machine>
      <machine id="sine2" type="source" plugin-name="audiotestsrc" voices="0">
        <properties>
          <property key="ypos" value="0.0"/>
          <property key="xpos" value="0.0"/>
        </properties>
        <globaldata name="wave" value="0"/>
        <globaldata name="freq" value="440"/>
        <globaldata name="volume" value="0.10000000000000001"/>
        <patterns>
          <pattern id="sine2_beep" name="beeps" length="8">
            <tick time="0">
              <globaldata name="freq" value="110"/>
            </tick>
            <tick time="2">
              <globaldata name="freq" value="220"/>
            </tick>
            <tick time="6">
              <globaldata name="freq" value="55"/>
            </tick>
          </pattern>
        </patterns>
      </machine>
      <machine id="volume" type="processor" plugin-name="volume" voices="0">
        <properties>
          <property key="ypos" value="0.69333333333333336"/>
          <property key="xpos" value="0.32000000000000001"/>
        </properties>
        <globaldata name="mute" value="0"/>
        <globaldata name="volume" value="1"/>
      </machine>
    </machines>
    <wires>
      <wire src="sine1" dst="amp1" gain="1.5"/>
      <wire src="sine2" dst="amp1" gain="0.5"/>
      <wire src="amp1" dst="audio_sink" gain="1" panorama="0">
        <patterns>
          <pattern id="audio_sink 00">
            <tick time="0">
              <wiredata name="panorama" value="-1"/>
            </tick>
            <tick time="7">
              <wiredata name="panorama" value="-0.87499809265136719"/>
            </tick>
            <tick time="15">
              <wiredata name="panorama" value="-0.74999618530273438"/>
            </tick>
          </pattern>
        </patterns>
      </wire>
      <wire src="sine1" dst="volume" gain="1"/>
      <wire src="volume" dst="audio_sink" gain="1" panorama="0"/>
    </wires>
  </setup>
  <sequence length="16" tracks="2">
    <labels>
      <label name="start" time="0"/>
    </labels>
    <tracks>
      <track index="0" machine="sine1">
        <position time="0" pattern="sine1_beep"/>
      </track>
      <track index="1" machine="sine2">
        <position time="0" pattern="sine2_beep"/>
      </track>
    </tracks>
  </sequence>
</buzztard>
