<?xml version="1.0" encoding="UTF-8"?>

<buzztard
	xmlns="http://www.buzztard.org/"
	xmlns:xsd="http://www.w3.org/2001/XMLSchema-instance"
	xsd:noNamespaceSchemaLocation="buzztard.xsd">

	<meta>
		<info>three buzz generators</info>
	    <name>buzz 6</name>
		<genre>dark-wave</genre>
    	<bpm>120</bpm>
	    <tpb>4</tpb>
    	<bars>16</bars>
	</meta>
	
  <setup zoom="1.0">
    <machines>
      <sink id="audio_sink">
        <properties>
          <property key="xpos" value="0.7"/>
          <property key="ypos" value="0.0"/>
        </properties>
        <globaldata name="volume" value="20"/>
        <globaldata name="bpm" value="145"/>
      </sink>
      
      <source id="bd" pluginname="bml-ErsKick" voices="1">
        <properties>
          <property key="xpos" value="-0.7"/>
          <property key="ypos" value="-0.5"/>
        </properties>
        <globaldata name="volume" value="1.0"/>
      </source>

      <source id="snr" pluginname="bml-ErsSnare" voices="1">
        <properties>
          <property key="xpos" value="-0.7"/>
          <property key="ypos" value="0.0"/>
        </properties>
        <globaldata name="volume" value="1.0"/>
      </source>

    <source id="hh" pluginname="bml-ErsHihat" voices="1">
        <properties>
          <property key="xpos" value="-0.7"/>
          <property key="ypos" value="0.5"/>
        </properties>
        <globaldata name="volume" value="1.0"/>
      </source>
    </machines>
    
    <wires>
      <wire src="bd" dst="audio_sink" gain="1.0" pan="-50"/>
      <wire src="snr" dst="audio_sink" gain="1.0" pan="-50"/>
      <wire src="hh" dst="audio_sink" gain="1.0" pan="-50"/>
    </wires>    
  </setup>
  
  <patterns>
    <pattern id="bd_beats" machine="bd" name="beats" length="16">
      <tick time= "0"><voicedata name="Trig" voice="0" value="1"/></tick>
      <tick time= "4"><voicedata name="Trig" voice="0" value="1"/></tick>
      <tick time= "8"><voicedata name="Trig" voice="0" value="1"/></tick>
      <tick time="12"><voicedata name="Trig" voice="0" value="1"/></tick>
    </pattern>
    <pattern id="snr_beats" machine="snr" name="beats" length="16">
      <tick time= "4"><voicedata name="Trig" voice="0" value="1"/></tick>
      <tick time="12"><voicedata name="Trig" voice="0" value="1"/></tick>
    </pattern>
  </patterns>
  
  <sequence>
    <labels>
      <label time="0" name="start"/>
      <label time="63" name="end"/>
    </labels>
    <tracks>
      <track index="0" machine="bd">
        <position time="0" pattern="bd_beats"/>
        <position time="32" pattern="bd_beats"/>
      </track>
      <track index="1" machine="snr">
        <position time="0" pattern="snr_beats"/>
        <position time="16" pattern="snr_beats"/>
        <position time="32" pattern="snr_beats"/>
        <position time="48" pattern="snr_beats"/>
      </track>
    </tracks>
  </sequence>
  
  <wavetable/>

</buzztard>
